<?xml version="1.0" encoding="UTF-8" ?>
<!ELEMENT GameMoves (GameMove+)>
<!ELEMENT GameMove (Symbol, PositionX, PositionY)>
<!ELEMENT Symbol (#PCDATA)>
<!ELEMENT PositionX (#PCDATA)>
<!ELEMENT PositionY (#PCDATA)>